{
  "$schema": "https://json-schema.org/draft/2020-12/schema",
  "$id": "vandikkaran-magan-translation-scene-record-schema",
  "title": "Vandikkaran Magan source-linked English translation scene record",
  "type": "object",
  "required": [
    "work_id",
    "target_language",
    "scene_id",
    "scene_ordinal",
    "source_scene_id",
    "scene_status",
    "unit_count",
    "units"
  ],
  "properties": {
    "work_id": {
      "const": "vandikkaran-magan"
    },
    "target_language": {
      "const": "en"
    },
    "scene_id": {
      "type": "string",
      "pattern": "^vandikkaran-magan-s[0-9]{3}$"
    },
    "scene_ordinal": {
      "type": "integer",
      "minimum": 1,
      "maximum": 72
    },
    "source_scene_id": {
      "type": "string",
      "minLength": 1
    },
    "pilot_status": {
      "enum": [
        "draft",
        "review",
        "verified"
      ]
    },
    "scene_status": {
      "enum": [
        "draft",
        "review",
        "verified"
      ]
    },
    "unit_count": {
      "type": "integer",
      "minimum": 0
    },
    "units": {
      "type": "array",
      "items": {
        "$ref": "#/$defs/unit"
      }
    }
  },
  "additionalProperties": false,
  "$defs": {
    "page": {
      "type": "object",
      "required": [
        "pdf_page",
        "printed_page"
      ],
      "properties": {
        "pdf_page": {
          "type": "integer",
          "minimum": 1
        },
        "printed_page": {
          "type": [
            "integer",
            "null"
          ],
          "minimum": 1
        }
      },
      "additionalProperties": false
    },
    "locator": {
      "type": [
        "object",
        "null"
      ],
      "required": [
        "kind",
        "ordinal",
        "description"
      ],
      "properties": {
        "kind": {
          "type": "string"
        },
        "ordinal": {
          "type": "integer",
          "minimum": 1
        },
        "description": {
          "type": "string"
        }
      },
      "additionalProperties": false
    },
    "source": {
      "type": "object",
      "required": [
        "source_path",
        "canonical_scene_path",
        "source_record_id",
        "source_occurrence_id",
        "source_locator",
        "speaker_label",
        "speaker_label_origin",
        "source_delimiter",
        "page_provenance"
      ],
      "properties": {
        "source_path": {
          "type": "string",
          "minLength": 1
        },
        "canonical_scene_path": {
          "type": "string",
          "minLength": 1
        },
        "source_record_id": {
          "type": [
            "string",
            "null"
          ]
        },
        "source_occurrence_id": {
          "type": [
            "string",
            "null"
          ]
        },
        "source_locator": {
          "$ref": "#/$defs/locator"
        },
        "speaker_label": {
          "type": [
            "string",
            "null"
          ]
        },
        "speaker_label_origin": {
          "type": [
            "string",
            "null"
          ],
          "enum": [
            "source-explicit",
            "source-unlabelled",
            null
          ]
        },
        "source_delimiter": {
          "type": [
            "string",
            "null"
          ]
        },
        "page_provenance": {
          "type": "array",
          "minItems": 1,
          "items": {
            "$ref": "#/$defs/page"
          }
        }
      },
      "additionalProperties": false
    },
    "translation": {
      "type": "object",
      "properties": {
        "english_text": {
          "type": "string",
          "minLength": 1
        },
        "english_lines": {
          "type": "array",
          "minItems": 1,
          "items": {
            "type": "string",
            "minLength": 1
          }
        },
        "mode": {
          "enum": [
            "prose-faithful",
            "semantic-poetic-source-faithful"
          ]
        },
        "notes": {
          "type": "array",
          "items": {
            "type": "string"
          }
        }
      },
      "oneOf": [
        {
          "required": [
            "english_text",
            "mode",
            "notes"
          ]
        },
        {
          "required": [
            "english_lines",
            "mode",
            "notes"
          ]
        }
      ],
      "additionalProperties": false
    },
    "unit": {
      "type": "object",
      "required": [
        "id",
        "kind",
        "status",
        "target_language",
        "scene_id",
        "scene_ordinal",
        "source_scene_id",
        "source",
        "translation"
      ],
      "properties": {
        "id": {
          "type": "string",
          "pattern": "^vandikkaran-magan-en-s[0-9]{3}-u[0-9]{3}$"
        },
        "kind": {
          "enum": [
            "narrative",
            "dialogue",
            "stage-direction",
            "performance-cue",
            "song",
            "written-text",
            "chant"
          ]
        },
        "status": {
          "enum": [
            "draft",
            "review",
            "verified"
          ]
        },
        "target_language": {
          "const": "en"
        },
        "scene_id": {
          "type": "string"
        },
        "scene_ordinal": {
          "type": "integer"
        },
        "source_scene_id": {
          "type": "string"
        },
        "source": {
          "$ref": "#/$defs/source"
        },
        "translation": {
          "$ref": "#/$defs/translation"
        }
      },
      "additionalProperties": false
    }
  }
}
